id,URL,headline,author,date
0,https://theverge.com/2023/3/31/23664849/twitter-releases-algorithm-musk-open-source,"Twitter takes its algorithm ‘open-source,’ as Elon Musk promised",Mitchell Clark,Mar 31
1,https://theverge.com/2023/3/31/23664113/toys-hasbro-ceo-chris-cocks-magic-dungeons-and-dragons-transformers-business,"The surprisingly complex business of toys, with Hasbro CEO Chris Cocks",Nilay Patel,Mar 31
2,https://theverge.com/2023/3/31/23663214/best-ways-to-play-tetris-2023,The best ways to play Tetris in 2023,Andrew Webster,Mar 31
3,https://theverge.com/2023/3/30/23660652/asus-rog-flow-z13-acronym-gaming-laptop-tablet-review,"Y’all, this laptop is too much",Monica Chin,Mar 31
4,https://theverge.com/2023/3/31/23655322/fitbit-charge-3-button-of-the-month,Fitbit’s attempt to disappear the button proved why they matter,Victoria Song,Mar 31
